,Item ID,Title,Price,Condition,Description,Number_of_pictures,Delivery,Shipping,Distance,Ship_Location,Ship_Price,Location,City,State,Time
230,783795509,IPhone XS MAX/ NOTE9/ S9plus clear case protective covers lot,100,Other (see description),IPhone XS MAX/ NOTE9/ S9plus clear case protective covers Slim fit Shock absorption Crystal clear Box of 340 items estimate Cases for;iPhone XS Max Note 9Samsung 9 plus Take all $100 firm Tome todas,6,Local pickup (18 miles away),No shipping INFO!,18.0,,,"San Diego, CA",San Diego, CA,4 hours 
231,783791191,3 (1m) Apple IPhone Lightning Usb Cables,15,New (never used),No description. Ask seller for more details,1,Local pickup (15 miles away),No shipping INFO!,15.0,,,"San Diego, CA",San Diego, CA,4 hours 
232,783789206,iPhone X,350,Used (normal wear),Back is cracked but DOES NOT effect the phone. Unlocked carrier 64 gigsWilling to trade to X or newer plus cash,3,Local pickup (18 miles away),No shipping INFO!,18.0,,,"Spring Valley, CA",Spring Valley, CA,4 hours 
233,783781988,Apple iPhone XS Max,800,Used (normal wear),"iPhone XS Max Space Gray color (UNLOCKED). Used less than a year.  Battery in Great condition.  Not drop, no scratches, dents or cracks.  No power adapter or charge cable just the phone. I have the original box and comes with a good condition case.  NO PAY PAL, SHIPPING AND LOCAL PICK UP ONLY.  ",5,Local pickup (22 miles away),No shipping INFO!,22.0,,,"Escondido, CA",Escondido, CA,4 hours 
234,783777411,iPhone 7 Gold,260,Used (normal wear),• 256 GB• Gold• Factory unlocked ( can be used with ANY company ),4,Local pickup (25 miles away),No shipping INFO!,25.0,,,"San Diego, CA",San Diego, CA,4 hours 
235,783767826,iPhone 6 64GB,Sold!,Used (normal wear),Unlocked ,3,Local pickup (24 miles away),No shipping INFO!,24.0,,,"Oceanside, CA",Oceanside, CA,5 hours 
236,783766905,iPhone 6,140,Used (normal wear),"💵 Price is Firm 💵📱Unlocked for all carriers: Works on AT&T, CricKet, T-Mobile, Metro PCS, Simple Mobile, Telcel, Verizon, Sprint overseas etc. iPhone 6 - 16GB - Space Gray ColorHas wear on frame etc, no cracks. Works well✅Clean IMEI♻️Reset Back to Factory Settings📞Bring your SIM card and make a test call!💵 Price is Firm 💵I can also give you a credit towards iPhones, iPads, MacBooks and Apple Watch. Tell me what you have and how much u want for it towards the trade. Tell me Model, Carrier, Condition and GB",3,Local pickup (10 miles away),No shipping INFO!,10.0,,,"San Diego, CA",San Diego, CA,5 hours 
237,783945172,I phone 7+,350,Used (normal wear),iPhone 7+  unlocked minor dent asking 350 lowest 300 hmu no trade,4,No delivery INFO!,"Ships from Fresno, CA for $7",,"Fresno, CA",7,"Fresno, CA",Fresno, CA,8 minutes 
238,783762519,"Firm Price! Brand New in a Box Case for iPhone 6/6s, Located in North Park for Pick Up or Shipping Only!",10,New (never used),"Brand new case, never been used. For pick up or shipping only. Price is firm.",3,Local pickup (13 miles away),Ships for $3,13.0,,3,"San Diego, CA",San Diego, CA,5 hours 
239,783757529,iPhone X 256g brand new unlocked Verizon,700,New (never used),Brand new 256 g iPhone X  More details please feel free to ask me a question or make an offer ,3,Local pickup (21 miles away),No shipping INFO!,21.0,,,"Imperial Beach, CA",Imperial Beach, CA,5 hours 
240,783946377,Three iPhone Chargers & Three Wall Adapters,25,New (never used),"Pickup only or can ship.3 cables and 3 adapters. Brand new.3.3ft in Length Cables- Lightning USB iPhone ChargerCompatible with: (iPhone 5, 5S, 6, 6S PLUS, 7, 8)-Premium Quality-iOS 9/10 Compatibility- Thicker cable than most generic chargers allowing for better durability and long lasting life of the charger.These come without a retail box. All are new and of great quality!",1,No delivery INFO!,"Ships from Las Vegas, NV for $3",,"Las Vegas, NV",3,"Las Vegas, NV",Las Vegas, NV,6 minutes 
241,783745955,iPhone 7 UNLOCKED,Sold!,New (never used),Unlocked for any carrierHmu for more detailsEverything works fine just small crack on lower left corner doesn’t affect screen,2,Local pickup (11 miles away),No shipping INFO!,11.0,,,"San Diego, CA",San Diego, CA,5 hours 
242,783737404,Smart watch for iPhone and Android phones,40,New (never used),No description. Ask seller for more details,1,Local pickup (24 miles away),No shipping INFO!,24.0,,,"El Cajon, CA",El Cajon, CA,6 hours 
243,783726304,iPhone X,200,Used (normal wear),Unlocked has scratches in screen and cracked from the back give me an offer  64 gb ,2,Local pickup (19 miles away),No shipping INFO!,19.0,,,"Spring Valley, CA",Spring Valley, CA,6 hours 
244,746312102,IPhone X box IPhone XS box with documents from store.,19,New (never used),No phones just the boxes.  ,8,Local pickup (10 miles away),No shipping INFO!,10.0,,,"San Diego, CA",San Diego, CA,6 hours 
245,783713238,iPhone XR 128 GB - NEW,500,Open box (never used),"iPhone XR Color: CoralMemory: 128GB Condition: 10/10Carrier: AT&T and Cricket Wireless My mother used the phone for a few weeks. The phone was always protected with a case and screen protector. All accessories are included, the headphones have never been used. I have reset the phone and it is ready to be set as a new phone. I will also throw in 4 cases.If you have any further questions feel free to ask. Hablo Español ",9,Local pickup (12 miles away),Ships for $3,12.0,,3,"San Diego, CA",San Diego, CA,6 hours 
246,783707403,iPhone 6s,130,Used (normal wear),It’s rose gold and In great condition. It’s for sprint  carrier and unlocked ,5,Local pickup (25 miles away),No shipping INFO!,25.0,,,"El Cajon, CA",El Cajon, CA,6 hours 
247,783947726,New iphone 6S grey in color,175,New (never used),Brand new iphone 6S just recieved from Apple,3,No delivery INFO!,"Ships from Littlefield, TX for $7",,"Littlefield, TX",7,"Littlefield, TX",Littlefield, TX,3 minutes 
248,783700088,Bodyguardz iPhone 6 6s,25,New (never used),No description. Ask seller for more details,3,Local pickup (14 miles away),No shipping INFO!,14.0,,,"San Diego, CA",San Diego, CA,6 hours 
249,783697131,"IPHONE 6 S PLUS (64G) FACTORY UNLOCKED AT&T, T-MOBILE, METRO PCS, CRICKET",250,Used (normal wear),"IPHONE 6 S PLUS (64G) FACTORY UNLOCKED AT&T, T-MOBILE, METRO PCS, CRICKETIphone 6s plus, works with AT&T but unlocked so you can use it on any carrier. No cracks or scratches. It has 64 gb and ready for you to use. Comes with case & screen protector.Fingerprint works perfect, changed battery at Apple in December of 2018 under the promotion they had for $39 which expired last year.Can use on ATT, T-mobile, Metro, Cricket etc..Only Selling coz i just upgraded to a new phone. Works great.. Price $250 or best offer.. Serious inquiries only please! Thank youAtt, tmobile, cricket, metro, i phone 6s+ 6s plus + at& t metropcs tmobile t mobile t-mobile ",4,Local pickup (15 miles away),No shipping INFO!,15.0,,,"San Diego, CA",San Diego, CA,7 hours 
250,783689825,iPhone X case bundle,10,Used (normal wear),Some of the cases been used some are new. Selling as a bundle. ,5,Local pickup (7 miles away),Ships for $3,7.0,,3,"San Diego, CA",San Diego, CA,7 hours 
251,783685126,"iPhone XR Leather Wallet Case, w/a Small Mirror",50,Used (normal wear),No description. Ask seller for more details,5,Local pickup (24 miles away),No shipping INFO!,24.0,,,"Oceanside, CA",Oceanside, CA,7 hours 
252,783682855,iPhone 8 Plus,350,Used (normal wear),I phone 8 plus. Everything works great. Small crack bottom left screen.,1,Local pickup (23 miles away),No shipping INFO!,23.0,,,"San Marcos, CA",San Marcos, CA,7 hours 
253,783653020,iPhone 8+ 64GB T-Mobile,450,Used (normal wear),iPhone 8 PLUS 64GB T-Mobile Like NEW ALWAYS HAS BEEN IN CASE  With  Charger and Cases * LIFEPROOF CASE * WHITE / GOLD MARBLE CASE * BLACK / SILVER CARD HOLDER CASE * CLEAR WITH GLITTER CASE JUST UPGRADED TO IPHONE 11 PRO SO NEED TO SALE THIS ONE !!!ALL FOR $450.00 OR BEST OFFER ,7,Local pickup (23 miles away),No shipping INFO!,23.0,,,"Chula Vista, CA",Chula Vista, CA,7 hours 
254,783672641,iPhone 6 Plus Gold 64GB unlocked,175,Used (normal wear),"iPhone 6 Plus Gold 64GBItem is in great condition, very light, if any, scratches on the body. Screen is intact with no visible scratching. GSM Unlocked.  Case included. $175",6,Local pickup (11 miles away),No shipping INFO!,11.0,,,"San Diego, CA",San Diego, CA,7 hours 
255,783667291,iPhone XS Max 64 GB - at&t,800,Open box (never used),Check it out! Phone has not been paid off yet but it’s only $550 to pay off and we can meet in store to do that then it’s yours. Asking $800 for the whole thing as once it’s paid off it can be unlocked to any carrier. Comes with original box and phone. Let me know if you have any questions ,3,Local pickup (13 miles away),No shipping INFO!,13.0,,,"San Diego, CA",San Diego, CA,7 hours 
256,783661590,Apple//iPhone//11Pro///MAX//512GB,Sold!,Used (normal wear),"Hi , I'm trying to help my aunt to sell her [email protected]$400. In perfect condition, contact her [email protected]{contact info removed}",1,Local pickup (22 miles away),No shipping INFO!,22.0,,,"Chula Vista, CA",Chula Vista, CA,8 hours 
257,783656603,AT&T iPhone 7,125,Used (normal wear),Works perfectly fine. There’s a crack in the front screen. Iphone is priced to sell. 32gb at&t Iphone. $125 ,3,Local pickup (13 miles away),No shipping INFO!,13.0,,,"San Diego, CA",San Diego, CA,8 hours 
258,783655109,Galaxy A10e MetroPCS,80,Used (normal wear),2 weeks old great condition. Wife surprised me with iPhone with tmobile so no longer need this one. Will come with free service till 5th December  or switch to your account or name.,1,Local pickup (21 miles away),Ships for $3,21.0,,3,"Chula Vista, CA",Chula Vista, CA,8 hours 
259,783647394,iphone 7+,Sold!,Open box (never used),cracked 32 gb sprint & verizon ,2,Local pickup (26 miles away),No shipping INFO!,26.0,,,"San Diego, CA",San Diego, CA,8 hours 
260,783633505,"Invisible shield, iPhone max",25,New (never used),New ,2,Local pickup (22 miles away),No shipping INFO!,22.0,,,"Chula Vista, CA",Chula Vista, CA,8 hours 
261,783631779,iPhone 7 Plus,325,Used (normal wear),T-Mobile perfect conditions ,3,Local pickup (23 miles away),No shipping INFO!,23.0,,,"Oceanside, CA",Oceanside, CA,8 hours 
262,783616646,IPHONE 7 256Gb Blk Factory Unlocked,280,Used (normal wear),"Good Battery Life and Clean IMEI, not reported stolen. We offer warranty on all of our phones.All of our phones are used but in great Shape! Factory unlocked which means you can put any Sim Card  with service and it will work.Comes with:House Charger Buy with confidence ",4,Local pickup (17 miles away),No shipping INFO!,17.0,,,"National City, CA",National City, CA,9 hours 
263,783581797,iPhone 8 perfect condition,220,Reconditioned/Certified,iPhone 8. Like new. Certified reconditioned. No scratches and works perfectly ,2,Local pickup (12 miles away),No shipping INFO!,12.0,,,"San Diego, CA",San Diego, CA,9 hours 
264,783602542,Case iPhone,16,New (never used),New case with good design and color for iPhone 7 Plus & 8 Plus includes : Cover case Stand holder  Strap ,4,Local pickup (18 miles away),No shipping INFO!,18.0,,,"Spring Valley, CA",Spring Valley, CA,9 hours 
265,783598728,Case iPhone,10,New (never used),New case elegant black with gold fir iPhone XS Max thanks for watching ,2,Local pickup (20 miles away),No shipping INFO!,20.0,,,"Spring Valley, CA",Spring Valley, CA,9 hours 
266,783580154,iPhone XS Max (box only),5,Used (normal wear),iPhone XS Max (box only),3,Local pickup (21 miles away),No shipping INFO!,21.0,,,"San Diego, CA",San Diego, CA,10 hours 
267,783564565,Wireless charger,16,New (never used),For iphone and Samsung ,2,Local pickup (23 miles away),No shipping INFO!,23.0,,,"Chula Vista, CA",Chula Vista, CA,11 hours 
268,783527560,iPhone 7 32GB (UNLOCKED)T-Mobile MetroPCs 🇲🇽 MEXICO CHIP AT&T Verizon Cricket sprint,250,Used (normal wear),iPhone :   iPhone (7)Storage :  32Gb Carrier : (Unlocked)AllColor :     SilveriCloud : Unlocked  ESn : CleanPhone is in good condition fully functional speakers cameras buttons no issues at all no cracks at all on the  LCD . 32 gb asking 250$I also have Matte- black 🌹 Gold/Jet-Black Gold ask .serious buyers please as we sell daily on here .. come with chargers,9,Local pickup (20 miles away),No shipping INFO!,20.0,,,"Chula Vista, CA",Chula Vista, CA,14 hours 
