,Item ID,Title,Price,Condition,Description,Number_of_pictures,Delivery,Shipping,Distance,Ship_Location,Ship_Price,Location,City,State,Time
154,783567739,IPhone 7 $200,200,Used (normal wear),No description. Ask seller for more details,3,Local pickup (24 miles away),No shipping INFO!,24.0,,,"El Cajon, CA",El Cajon, CA,10 hours 
155,783573666,iPhone X 256gb UNLOCKED clean (price reduced),450,Used (normal wear),Selling my iPhone X 256 gb Unlocked Screen protector already included.I am the first and only owner.I have upgraded my phone and have no use for this one anymore. Everything has been restored back to normal factory settings. Very minor crack on bottom back glass but doesn’t affect the phone whatsoever and can be covered easily with phone case. Has never been in water even though it is water resistant.Serious buyers only no trades,3,Local pickup (21 miles away),No shipping INFO!,21.0,,,"Chula Vista, CA",Chula Vista, CA,10 hours 
156,783528290,IPhone Verizon 64gb,550,New (never used),No description. Ask seller for more details,3,Local pickup (23 miles away),No shipping INFO!,23.0,,,"San Diego, CA",San Diego, CA,13 hours 
157,783882613,iPhone 6 16 gb unlocked black,150,Used (normal wear),"Mint Condition Works With any AT&T , Tmobile, Verizon, Cricket, Metro Network and Overseas.We have in stock, iPhone 6 - $150  | iPhone 7 - $249  | iPhone 7 Plus - $349iPhone 8 - $349  | iPhone 8 Plus - $449 Samsung S8 - $249 |   S8 Plus - $349Samsung S9 - $349 |   S9 Plus  - $399Samsung Note 8 - $349  |  Note 9 - $449 Comes with warranty Call us or stop by  Our store address :Payless Wireless6074 EL Cajon Blvd San Diego, CA - 92115",10,Local pickup (14 miles away),No shipping INFO!,14.0,,,"San Diego, CA",San Diego, CA,1 hour 
158,783946377,Three iPhone Chargers & Three Wall Adapters,25,New (never used),"Pickup only or can ship.3 cables and 3 adapters. Brand new.3.3ft in Length Cables- Lightning USB iPhone ChargerCompatible with: (iPhone 5, 5S, 6, 6S PLUS, 7, 8)-Premium Quality-iOS 9/10 Compatibility- Thicker cable than most generic chargers allowing for better durability and long lasting life of the charger.These come without a retail box. All are new and of great quality!",1,No delivery INFO!,"Ships from Las Vegas, NV for $3",,"Las Vegas, NV",3,"Las Vegas, NV",Las Vegas, NV,5 minutes 
159,783877469,iPhone XR,350,Used (normal wear),Like new red iPhone XR 64 GB this is an at&t Iphone. Comes with charger and portable charging device. No scratches or cracks very good condition.$350 obo,2,Local pickup (23 miles away),No shipping INFO!,23.0,,,"Carlsbad, CA",Carlsbad, CA,2 hours 
160,754605601,iPhone X 64gb space grey UNLOCKED,600,Reconditioned/Certified,"Not locked , will be formatted ready for use , UNLOCKED , front and back cameras are a bit scratched but other than that everything works for me. 64gb space grey UNLOCKED CARRIER",5,Local pickup (8 miles away),No shipping INFO!,8.0,,,"San Diego, CA",San Diego, CA,1 month 
161,783874463,iPhone 7,60,Reconditioned/Certified,its completely reset. esn might be bad so that’s why I have it low but it was for sprint 32 g. It’s cracked but not bad and it’s more for an iPod or parts ,2,Local pickup (16 miles away),Ships for $7,16.0,,7,"National City, CA",National City, CA,2 hours 
162,783863409,iPhone 6 - Black - 64gb - UNLOCKED - Fully Working - No Cracks,180,Used (normal wear),64 gb. Price is firm .*Fully unlocked and with current IOS installed.*No cracks / No scratches on screen.   *100% Fully functional.Some minor scuffs on back but this was from it being in a case. You won’t notice these when you put in a case.,4,Local pickup (6 miles away),No shipping INFO!,6.0,,,"San Diego, CA",San Diego, CA,2 hours 
163,783946949,iPhone 7 128GB paid off mint condition,240,Used (normal wear),I’m selling my grandpas phone for him always had an otter box case and screen protector no marks ,5,Local pickup (78 miles away),Ships for $7,78.0,,7,"Seal Beach, CA",Seal Beach, CA,4 minutes 
164,783853240,Airpods,80,Used (normal wear),80 nothing wrong just misplaced the charger but any iPhone charger will work :) ,1,Local pickup (17 miles away),No shipping INFO!,17.0,,,"San Diego, CA",San Diego, CA,2 hours 
165,783851320,iPhone XR 128gb unlocked,520,Used (normal wear),"iPhone XR 128gb unlocked (Black)Comes with box and charger, no earpods. Has a small scratch on back that you can see in the picture. ",3,Local pickup (21 miles away),No shipping INFO!,21.0,,,"Bonita, CA",Bonita, CA,2 hours 
166,783845213,Iphone 8 -64gb Brand new,449,New (never used)," A brand new, unopened, undamaged, item in its original packaging.$449.99Port in price new line or upgrade - Cricket Wireless PBFirst mo svc charge & tax due at sale ",1,Local pickup (5 miles away),No shipping INFO!,5.0,,,"San Diego, CA",San Diego, CA,3 hours 
167,783823832,iPhone 4s. 50!$,Sold!,Used (normal wear),iPhone 4s. Good phone. Needs battery but works plugged in.,4,Local pickup (14 miles away),No shipping INFO!,14.0,,,"San Diego, CA",San Diego, CA,3 hours 
168,783819045,Samsung Galaxy Note 8 Unlocked - excellent condition,349,Used (normal wear),"Mint Condition Works With any AT&T , Tmobile, Verizon, Cricket, Metro Network and Overseas.We have in stock, iPhone 6 - $150  | iPhone 7 - $249  | iPhone 7 Plus - $349iPhone 8 - $349  | iPhone 8 Plus - $449 Samsung S8 - $249 |   S8 Plus - $349Samsung S9 - $349 |   S9 Plus  - $399Samsung Note 8 - $349  |  Note 9 - $449 Comes with warranty Call us or stop by  Our store address :Payless Wireless6074 EL Cajon Blvd San Diego, CA - 92115",10,Local pickup (14 miles away),No shipping INFO!,14.0,,,"San Diego, CA",San Diego, CA,3 hours 
169,783815950,iPhone 7 Black 256GB UNLOCKED Or SPRINT,280,Used (normal wear),"In great condition. No damage, comes with of without Lumee light case. ",1,Local pickup (18 miles away),No shipping INFO!,18.0,,,"Spring Valley, CA",Spring Valley, CA,3 hours 
170,783813610,IPHONE 6S PLUS 32& 64GB FACTORY UNLOCKED FOR ANY CARRIER WORLDWIDE,225,Used (normal wear),"iPhone 6s Plus 32GB & 64GB unlocked to use with any carrier worldwide. It works 100%, no issues. Comes with an original charging cable.30 days warrantyPrice is fair and firmiPhone 6s Plus 32GB $224.99iPhone 6s Plus 64GB $239.99Price is for each iPhone and is FIRM priceFUNCIONA PARA MEXICO: TELCEL, MOVISTAR, AT&T, UNEFON, ETC ",1,Local pickup (15 miles away),No shipping INFO!,15.0,,,"San Diego, CA",San Diego, CA,3 hours 
171,783811695,iPhone 8 Plus both sides scratched up T-Mobile / metro,350,Used (normal wear),No description. Ask seller for more details,2,Local pickup (11 miles away),No shipping INFO!,11.0,,,"San Diego, CA",San Diego, CA,3 hours 
172,783804912,IPHONE 8 64GB LIKE NEW CONDITION FOR CRICKET ONLY,300,Used (normal wear),iPh1 8 64GB like new condition for cricket carrier only. It works excellent and comes with a charging cable. Please bring your cricket sim card to test it at my location or I can meet you at cricket store also. {contact info removed}PRICE IS NOT NEGOTIABLE,4,Local pickup (16 miles away),No shipping INFO!,16.0,,,"San Diego, CA",San Diego, CA,4 hours 
173,783798491,4 Brand New Original Apple IPhone Chargers,40,New (never used),No description. Ask seller for more details,1,Local pickup (17 miles away),No shipping INFO!,17.0,,,"National City, CA",National City, CA,4 hours 
174,783796536,Iphone 11 pro,750,Used (normal wear),Iphone 11 pro T mobileClean imei,3,Local pickup (16 miles away),No shipping INFO!,16.0,,,"San Diego, CA",San Diego, CA,4 hours 
175,783794324,iPhone X (64g) brand new w/ Applecare+ (4/2020),750,New (never used),"Brand New from Apple store. Unlocked. All carriers even international.  Model a1865. 64g. Comes with Apple Care+ with zero claims, until 4/2020. ",6,Local pickup (12 miles away),No shipping INFO!,12.0,,,"Coronado, CA",Coronado, CA,4 hours 
176,783790676,IPHONE SE,80,Used (normal wear),Iphone SE 16GB Unblocked and works great,3,Local pickup (10 miles away),No shipping INFO!,10.0,,,"San Diego, CA",San Diego, CA,4 hours 
177,783788843,2 (1m) Apple IPhone Lightning Usb Cables,10,New (never used),No description. Ask seller for more details,1,Local pickup (17 miles away),No shipping INFO!,17.0,,,"National City, CA",National City, CA,4 hours 
178,783778365,iPhone 7 ***icloud locked***,120,Used (normal wear),"No damage, good glass, good case, good battery",3,Local pickup (23 miles away),Ships for $3,23.0,,3,"Oceanside, CA",Oceanside, CA,4 hours 
179,783767942,iPhone X 256gb,400,Reconditioned/Certified,"Upgraded phones just trying to get rid of my oldOne. No issues whatsoever, it’s a replacement from apple.",3,Local pickup (25 miles away),No shipping INFO!,25.0,,,"Chula Vista, CA",Chula Vista, CA,5 hours 
180,783767249,Logitech K810 Wireless Keyboard,65,Used (normal wear),"- Bright backlit keyboard- Bluetooth - Rechargeable - Works with Windows 7, Windows 8, Windows 10, Iphone, iPad 2, iPad (3rd and 4th generation) and moreIncluded: Hermitshell Hard Travel storage ",3,Local pickup (14 miles away),No shipping INFO!,14.0,,,"San Diego, CA",San Diego, CA,5 hours 
181,783763840,"Firm Price! Brand New SPECK Case for iPhone 6/6s, Located in North Park for Pick Up or Shipping Only!",15,New (never used),"Brand new case, never been used. For pick up or shipping only. Price is firm. PHONE NOT INCLUDED.",4,Local pickup (13 miles away),Ships for $3,13.0,,3,"San Diego, CA",San Diego, CA,5 hours 
182,783759262,iPhone 8 64gb product red iPhone,300,Open box (never used),"New, clean imei, unlocked ",2,Local pickup (18 miles away),No shipping INFO!,18.0,,,"San Diego, CA",San Diego, CA,5 hours 
183,783753388,iPhone 7 32 gb AT&T,Sold!,Used (normal wear),Really good condition ,2,Local pickup (20 miles away),No shipping INFO!,20.0,,,"Chula Vista, CA",Chula Vista, CA,5 hours 
184,783750220,IPHONE 6s 16Gb Factory Unlocked Any Carrier,150,Used (normal wear),"Good Battery Life and Clean IMEI, not reported stolen. We offer warranty on all of our phones.All of our phones are used but in great Shape! Factory unlocked which means you can put any Sim Card  with service and it will work.Comes with:House Charger Buy with confidence ",4,Local pickup (18 miles away),No shipping INFO!,18.0,,,"Chula Vista, CA",Chula Vista, CA,5 hours 
185,783738477,iPhone 8plus,280,Used (normal wear),"I have my iPhone 8 Plus 64g  bought this phone new 2 years ago.  I recently drove it, front and back crack. Phone still works perfectly I don’t have any issues with it. I was told I can fix the front screen for $40 dollars, honestly I just want a new phone. Let me know if you have any questions. I’m actually using the phone to do this until I sale it. ",3,Local pickup (7 miles away),No shipping INFO!,7.0,,,"San Diego, CA",San Diego, CA,5 hours 
186,783735208,IPHONE 7+ PLUS 32GB UNLOCKED FOR ANY CELLPHONE COMPANY FEEL FREE TO TEST IT OUT BEFORE PURCHASING EVERYTHING WORKS💯%👈🏼,274,Used (normal wear),"BLACK IPHONE 7+ PLUS ✅  32GB STORAGE ✅ ICLOUD UNLOCKED ✅ CLEAN IMEI✅ CHARGER ,CELLPHONE CASE INCLUDED. WE CAN MEET AT ANY CELLPHONE STORE VERIFY EVERYTHING WORKS. Cracked lower part of the front screen. Does not effect phone. (Shown on last picture)CASH ONLY NO TRADESLow offers will be ignored.",7,Local pickup (22 miles away),No shipping INFO!,22.0,,,"Escondido, CA",Escondido, CA,6 hours 
187,638364201,Scooch 5 in 1 phone case. Military grade protection.,13,Used (normal wear),"Slightly used Scooch phone case.  Definitely the most versatile and durable phone case on the market for your iPhone X. The wingman is so useful from being a stand , to hooking on to AC vent or just gripping the phone for selfies.  Was $49 brand new. Letting it go for $13.50. ",6,Local pickup (10 miles away),No shipping INFO!,10.0,,,"San Diego, CA",San Diego, CA,6 hours 
188,783712898,Iphone 8 plus. 64 gb,380,Used (normal wear),Iphone 8 plus 64 gbTmobile metro pcs simpleNot unlockedHave chargerNo issues,1,Local pickup (16 miles away),No shipping INFO!,16.0,,,"San Diego, CA",San Diego, CA,6 hours 
189,783707318,iPhone 7plus,Sold!,Used (normal wear),$200 cash only.  Firm !! Good condition no cracks. Unlocked.  No iCloud test and see on spot. ,2,Local pickup (8 miles away),No shipping INFO!,8.0,,,"San Diego, CA",San Diego, CA,6 hours 
190,783705785,iPhone case for 7/8 not plus,30,New (never used),No description. Ask seller for more details,1,Local pickup (17 miles away),No shipping INFO!,17.0,,,"La Mesa, CA",La Mesa, CA,6 hours 
191,783698142,iPhone 8 -Unlocked- 256GB,400,Used (normal wear),"iPhone 8256 GigabytesUnlocked(Unlocked for use with any US carrier and international as well: Verizon, Metro PCS, T-Mobile, China, Brazil, Mexico, Spain, France, Europe, Asia, China, etc.)Comes with the original box and all accessories including brand new (unopened) usb cable and charger!!!This is a great deal!! Great condition iPhone!Will throw in 5 brand new Screen Protector as well!!Your welcome to test it and make sure everything works. Put your SIM card in it. Im an honest seller. See my reviews.$400I’m in no rush to sell. Price is firm.If you want to pay less please look for a lower model iPhone or one with less GB space.",5,Local pickup (11 miles away),No shipping INFO!,11.0,,,"San Diego, CA",San Diego, CA,7 hours 
192,783696192,IPHONE PRO 11 (CARRIER UNLOCKED WITH RECEIPT) WAS PURCHASED AT APPLE STORE FAHION VALLEY,950,New (never used),"I AM WILLING TO MEET AT THE APPLE STORE FASHION VALLEY TO PROCESS THE TRANSACTION AS I WOULD RATHER HAVE CASH THAN A GIFT CARD TO 🍎. IN NO RUSH TO SELL BUT FIRT COME FIRST SERVE YOU WILL BE SAVING $50 PLUS TAX ON THE PHONE. INCLUDING A FREE CASE THAT ALSO COMES WITH RECEIPT PURCHASED FOR $130 AT THE SAME APPLE STORE IN FASHION VALLEY.   SO IF YOU ARE A SERIOUS BUYER AND ARE INTERESTED IN A BRAND NEW IPHONE PRO 11 WITH DISCOUNT RECEIPT CARRIER UNLOCKED FROM APPLE CAN HAVE TO SIM CARDS IN THE SAME PHONE AT ONCE FROM 2 DIFFERENT CARRIERS. THIS IS BASICALLY A POCKETSIZE MACBOOK WITH A FREE APPE WALLET CASE ALL PAPERS AND RECEIPTS AND APPLECARE WARRANTY INCLUDED. ALONG WITH PRODUCT REPLACEMENT OR DAMAGE PROTECTION WHICH COVERS LOST, STOLEN OR DAMAGED. THE REASON IM SELLING MY PHONE PHONE IS TO START PAYING BACK MY STUDENT LOANS THAT HAVE GOTTEN TO BE SO BEHIND THEY ARE SENDING BILLS TO MY FATHER WHO IS ON A FIXED INCOME. THIS WILL COME WITH ALL. THE GOODIES BRAND NEW IN THE BOX UPDATED HEADPHONES AND RIDICULOUSLY SUPER FAST CHARGING. WISH I DIDNT HAVE TO SELL BUT NEED THE MONEY SORRY NO NEGOTIATIONS.",6,Local pickup (12 miles away),No shipping INFO!,12.0,,,"San Diego, CA",San Diego, CA,7 hours 
193,783688973,iPhone 7 s unlocked,250,Used (normal wear),"Hi I have two iPhones 7 s for sale letting them go for 250$ each . Has a clean IMEI , I have a black one and rose gold there both unlocked for any carrier. I usually work all of San Diego area so in case you wanted to stop by and check them out . ",9,Local pickup (23 miles away),No shipping INFO!,23.0,,,"San Marcos, CA",San Marcos, CA,7 hours 
194,783683943,iPhone 7&8 plus cases,5,Used (normal wear),"Speck, case mate ",1,Local pickup (24 miles away),No shipping INFO!,24.0,,,"San Marcos, CA",San Marcos, CA,7 hours 
195,783682230,iPhone XR cases,10,Used (normal wear),"iPhone XR, cases! Both from target. Used only for a couple of days! ",1,Local pickup (22 miles away),No shipping INFO!,22.0,,,"San Marcos, CA",San Marcos, CA,7 hours 
196,783679053,IPhone 6 16gb for T-Mobile or metro pcs,140,Used (normal wear),Works great in great condition ready to be used for T-Mobile or metro pcs.,5,Local pickup (25 miles away),No shipping INFO!,25.0,,,"San Diego, CA",San Diego, CA,7 hours 
197,783671705,iPhone 7 Black 128gb,220,Used (normal wear),works w any carrier 220,2,Local pickup (18 miles away),No shipping INFO!,18.0,,,"San Diego, CA",San Diego, CA,7 hours 
198,783664164,iPhone 7 128GB,220,Used (normal wear),"💵 Price is Firm 💵📱Works on AT&T & CricKet Networks iPhone 7 - 128GB - Space Gray ColorGood Condition. Works well✅Clean IMEI♻️Reset Back to Factory Settings📞Bring your SIM card and make a test call!💵 Price is Firm 💵I can also give you a credit towards iPhones, iPads, MacBooks and Apple Watch. Tell me what you have and how much u want for it towards the trade. Tell me Model, Carrier, Condition and GB",3,Local pickup (10 miles away),No shipping INFO!,10.0,,,"San Diego, CA",San Diego, CA,7 hours 
199,783661137,Iphone 8 plus att,400,Used (normal wear),Att only brandnew 1 month used only no scratches at all.,1,Local pickup (20 miles away),No shipping INFO!,20.0,,,"El Cajon, CA",El Cajon, CA,8 hours 
200,783655442,IPhone X 256GB,Sold!,Used (normal wear),iPhone X 256GB great condition we were with Verizon than switch to T-Mobile so yes is factory unlocked . Come with new screens protector in box ,3,Local pickup (18 miles away),No shipping INFO!,18.0,,,"Chula Vista, CA",Chula Vista, CA,8 hours 
201,783650885,iPhone XS Max,600,Used (normal wear),Great condition 9.5/1064 gb gold Att and cricket Only iPhone ,3,Local pickup (14 miles away),No shipping INFO!,14.0,,,"San Diego, CA",San Diego, CA,8 hours 
202,783644302,Lumee iPhone 7/8 plus,25,Used (normal wear),"EVERYTHING WORKS! Lights turn on, perfectly ",3,Local pickup (22 miles away),No shipping INFO!,22.0,,,"San Marcos, CA",San Marcos, CA,8 hours 
203,783632873,Iphone XR,999,Used (normal wear),Fresh out the box well taken care of has otter box case and tempered glass screen protector. Carrier is spectrum. But you can always unlock it to your choice. Charger and box included ,3,Local pickup (12 miles away),No shipping INFO!,12.0,,,"San Diego, CA",San Diego, CA,8 hours 
204,783621352,iPhone XS Max 64GB Unlocked T-Mobile,749,Used (normal wear),No description. Ask seller for more details,7,Local pickup (25 miles away),No shipping INFO!,25.0,,,"Chula Vista, CA",Chula Vista, CA,9 hours 
205,783611464,Like New iPhone 7 locked,200,Open box (never used),It’s locked/passcodeCarrier AT&T,2,Local pickup (18 miles away),No shipping INFO!,18.0,,,"San Diego, CA",San Diego, CA,9 hours 
206,783606088,Cables USB,10,New (never used),"New cables  USB from Apple store for any iPhone, check my profile for new items thanks $10 Dlls each Buy 5 and give to you 1 FREE3 cables x $25 dlls ",3,Local pickup (19 miles away),No shipping INFO!,19.0,,,"Spring Valley, CA",Spring Valley, CA,9 hours 
207,783601440,Case iPhone (New),5,New (never used),New case for iPhone 7 Plus/ 8 Plus ,2,Local pickup (20 miles away),No shipping INFO!,20.0,,,"Spring Valley, CA",Spring Valley, CA,9 hours 
208,783596661,Rokform Phone Case Apple iPhone XS/X,25,Used (normal wear),"Slightly used iPhone case. Rokform  “Rugged” case... great for mounting on bikes, motorcycles etc. Please visit Rokform website for all accessories it’s compatible with.Retails for $40.",4,Local pickup (24 miles away),No shipping INFO!,24.0,,,"Chula Vista, CA",Chula Vista, CA,9 hours 
209,783575854,IPHONE 7,150,New (never used),Perfectly working iPhone $150 OBOwilling to trade for AirPods !,2,Local pickup (24 miles away),No shipping INFO!,24.0,,,"Vista, CA",Vista, CA,10 hours 
210,783546454,iPhone X 64GB,450,New (never used),Unlocked For Any Carrier ICloud Unlocked Just Has Minor Scratches And Front Screen Has Minor Cracks Works Perfect   ,2,Local pickup (12 miles away),No shipping INFO!,12.0,,,"San Diego, CA",San Diego, CA,12 hours 
211,724810348,iPhone 8 64gb,300,New (never used),Recently got the new iPhone this is an extra one I got. It’s never been used just trying to get rid of it I have no need for it.,3,Local pickup (19 miles away),No shipping INFO!,19.0,,,"El Cajon, CA",El Cajon, CA,3 months 
212,783881963,iPhone 8 plus silver 64 gb unlocked,449,Used (normal wear),"Mint Condition Works With any AT&T , Tmobile, Verizon, Cricket, Metro Network and Overseas.We have in stock, iPhone 6 - $150  | iPhone 7 - $249  | iPhone 7 Plus - $349iPhone 8 - $349  | iPhone 8 Plus - $449 Samsung S8 - $249 |   S8 Plus - $349Samsung S9 - $349 |   S9 Plus  - $399Samsung Note 8 - $349  |  Note 9 - $449 Comes with warranty Call us or stop by  Our store address :Payless Wireless6074 EL Cajon Blvd San Diego, CA - 92115",6,Local pickup (14 miles away),No shipping INFO!,14.0,,,"San Diego, CA",San Diego, CA,1 hour 
213,783877032,"NANAMI: Fast Wireless Charger, NANAMI Qi Certified Charger Wireless Charging Stand Compatible iPhone 11/11 Pro/11 Pro Max/XS/XS Max/XR/X/8/8 Plus,Sam",15,New (never used),No description. Ask seller for more details,6,Local pickup (10 miles away),No shipping INFO!,10.0,,,"San Diego, CA",San Diego, CA,2 hours 
214,783945172,I phone 7+,350,Used (normal wear),iPhone 7+  unlocked minor dent asking 350 lowest 300 hmu no trade,4,No delivery INFO!,"Ships from Fresno, CA for $7",,"Fresno, CA",7,"Fresno, CA",Fresno, CA,8 minutes 
215,783875528,IPhone 6s plus 32gb for T-Mobile network,220,Open box (never used),For sale IPhone 6s plus 32gb in mint condition! It is for T-Mobile,2,Local pickup (10 miles away),No shipping INFO!,10.0,,,"San Diego, CA",San Diego, CA,2 hours 
216,783872930,iPhone 7 Rose Gold 128GB Verizon Unlocked TMobile AT&T,255,Used (normal wear),"Model  A1660 Verizon GSM UnlockedNew condition, was barely used, no scratches anywhere, fully functional,  balance paid, clean IMEI, Works with Verizon and GSM carriers like T-Mobile, AT&T, Cricket, Simple Mobile, MetroPCS, Wireless GSM, H20, etc. and international GSM networks.Turned off find my phone and logged out from icloud.Latest iOS installed. Battery health  87%. Comes with charger, box, manual and protector.Cash or Paypal, no trades.",4,Local pickup (6 miles away),No shipping INFO!,6.0,,,"San Diego, CA",San Diego, CA,2 hours 
217,766591023,iPhone 7 White Screen Replacement,29,New (never used),"📱iPhone 7 White Screen Replacement⠀🛠 For extra money, we can repair it.🛠 All parts have a 3-month warranty.⠀📣 We have new items for sale, see our profile, thanks.📣 Also, we have new: screen replacement, batteries, charging ports, cameras, speakers, and home buttons for all:📱 iPhone🖥 iPad⌚️ iWatch💻 MacBook⠀🏢 Our Address:✅ 7710 Balboa Ave # 223b, 2nd floor, San Diego, CA 92111⠀🕒 Opening hours:✅ Monday - 10 am to 5 pm✅ Tuesday - 10 am to 5 pm✅ Wednesday - 10 am to 5 pm✅ Thursday - 10 am to 5 pm✅ Friday - 10 am to 5 pm✅ Saturday - We can come over to you (text/call us to set up an appointment).✅ Sunday - We can come over to you (text/call us to set up an appointment).⠀📞 Text/call us if you have any questions.⠀❗️All prices and conditions are valid only at the address indicated in this announcement(please ask for Taras).❗️ Price varies depending on the device model, and part needed.⠀😉Regards Taras",6,Local pickup (5 miles away),No shipping INFO!,5.0,,,"San Diego, CA",San Diego, CA,1 month 
218,783856570,"iPhone 7 PLUS 128gb Clean Unlocked AT&T, Cricket, , GSM",250,Used (normal wear),$250 cash firm 10/10 condition paid off att or cricket leave a phone number if you want to buy the phone!,2,Local pickup (11 miles away),No shipping INFO!,11.0,,,"San Diego, CA",San Diego, CA,2 hours 
219,783852761,Airpods,80,Used (normal wear),80 nothing wrong just misplaced the charger but any iPhone charger will work :) ,1,Local pickup (18 miles away),No shipping INFO!,18.0,,,"San Diego, CA",San Diego, CA,2 hours 
220,783848573,iPhone 6plus,130,Used (normal wear),iPhone 6 16gbUnlocked In good exterior condition But might need new digitizer Sometimes gets stuck But other that that good phone  Asking 130 ,3,Local pickup (20 miles away),No shipping INFO!,20.0,,,"Chula Vista, CA",Chula Vista, CA,2 hours 
221,783829298,IPhone XS 256 gb,888,Reconditioned/Certified,XS 256 GB IPHONE ,5,Local pickup (9 miles away),No shipping INFO!,9.0,,,"San Diego, CA",San Diego, CA,3 hours 
222,783826042,IPHONE 7,Sold!,Used (normal wear),unlocked iphone 7,3,Local pickup (25 miles away),No shipping INFO!,25.0,,,"Vista, CA",Vista, CA,3 hours 
223,783819224,iPhone 6 Gold 64GB Unlocked w/ Free Lumee Case!,180,Used (normal wear),Unlocked Gold iPhone 6 64GB can come with or without Lumee Light Cass. Was always used in case with screen protector ,2,Local pickup (16 miles away),No shipping INFO!,16.0,,,"La Mesa, CA",La Mesa, CA,3 hours 
224,783818086,"iPhone SE, Rose Gold 32GB",130,New (never used),No description. Ask seller for more details,3,Local pickup (18 miles away),No shipping INFO!,18.0,,,"San Diego, CA",San Diego, CA,3 hours 
225,783947726,New iphone 6S grey in color,175,New (never used),Brand new iphone 6S just recieved from Apple,3,No delivery INFO!,"Ships from Littlefield, TX for $7",,"Littlefield, TX",7,"Littlefield, TX",Littlefield, TX,3 minutes 
226,783812813,iPhone 6s,200,New (never used),Perfect condition ! ,2,Local pickup (20 miles away),No shipping INFO!,20.0,,,"El Cajon, CA",El Cajon, CA,3 hours 
227,783810772,iPhone 6 16 gb unlocked silver - excellent condition,150,Used (normal wear),"Mint Condition Works With any AT&T , Tmobile, Verizon, Cricket, Metro Network and Overseas.Comes with warranty Call us or stop by  Our store address :Payless Wireless6074 EL Cajon Blvd San Diego, CA - 92115",9,Local pickup (14 miles away),No shipping INFO!,14.0,,,"San Diego, CA",San Diego, CA,4 hours 
228,783801342,Apple Combo/Brand New Original Apple IPhone Charger and Car Charger,25,New (never used),No description. Ask seller for more details,3,Local pickup (16 miles away),No shipping INFO!,16.0,,,"National City, CA",National City, CA,4 hours 
229,783797953,3 Brand New Original Apple IPhone Chargers,30,New (never used),No description. Ask seller for more details,1,Local pickup (16 miles away),No shipping INFO!,16.0,,,"National City, CA",National City, CA,4 hours 
